{
  "$schema": "https://json-schema.org/draft/2020-12/schema",
  "$id": "https://teachonce.local/schema/dag.schema.json",
  "title": "TeachOnce executable DAG (LLD §4)",
  "type": "object",
  "additionalProperties": false,
  "required": ["id", "name", "version", "nodes", "edges"],
  "properties": {
    "id": { "type": "string" },
    "name": { "type": "string" },
    "version": { "type": "string" },
    "nodes": {
      "type": "array",
      "minItems": 2,
      "items": {
        "type": "object",
        "required": ["id", "type"],
        "properties": {
          "id": { "type": "string" },
          "type": { "enum": ["START", "ACTION", "DECISION", "END"] },
          "label": { "type": "string" },
          "tool": {
            "enum": ["crm", "device", "warranty", "diagnostics", "repair"]
          },
          "op": {
            "enum": [
              "LOOKUP_CUSTOMER",
              "GET_TICKET",
              "UPDATE_TICKET",
              "GET_DEVICE",
              "CHECK_WARRANTY",
              "GET_DIAGNOSTICS",
              "CREATE_REPAIR",
              "RECORD_PAID_OPTIONS"
            ]
          },
          "inputs": { "type": "object" },
          "branches": {
            "type": "array",
            "items": {
              "type": "object",
              "required": ["name"],
              "properties": { "name": { "type": "string" } }
            }
          },
          "outcome": { "type": "string" }
        },
        "additionalProperties": true
      }
    },
    "edges": {
      "type": "array",
      "items": {
        "type": "object",
        "required": ["from", "to"],
        "properties": {
          "from": { "type": "string" },
          "to": { "type": "string" },
          "when": { "type": ["string", "null"] }
        },
        "additionalProperties": false
      }
    }
  }
}
